{"schema_version":1,"id":"polymer-production","simulation":{"kind":"production","work_required":30,"power_per_work":2,"labor_per_work":1,"facility_tag":"chemical","inputs":[{"voxel":"chemical-feedstock","quantity":4}],"outputs":[{"voxel":"polymer","quantity":4}]},"display":{"name":"生产聚合物","description":"正式经济流程；批量、价值与速率为待用户试玩确认的第一版。"}}
