{"schema_version":1,"id":"recover-propulsion-equipment","simulation":{"kind":"recovery","work_required":20,"power_per_work":1,"labor_per_work":1,"facility_tag":"recovery","inputs":[{"voxel":"propulsion-equipment","quantity":4}],"outputs":[{"voxel":"mechanical-components","quantity":1},{"voxel":"electrical-components","quantity":1},{"voxel":"structural-metal","quantity":1}]},"display":{"name":"回收柴油机组","description":"正式经济流程；批量、价值与速率为待用户试玩确认的第一版。"}}
