{"schema_version":1,"id":"consumer-electronics-assembly","simulation":{"kind":"production","work_required":40,"power_per_work":1,"labor_per_work":1,"facility_tag":"electronics","inputs":[{"voxel":"electronic-components","quantity":4},{"voxel":"polymer","quantity":4},{"voxel":"glass","quantity":4}],"outputs":[{"voxel":"consumer-electronics","quantity":4}]},"display":{"name":"生产消费电子","description":"正式经济流程；批量、价值与速率为待用户试玩确认的第一版。"}}
