{"schema_version":1,"id":"industrial-machinery-assembly","simulation":{"kind":"production","work_required":40,"power_per_work":1,"labor_per_work":1,"facility_tag":"assembly","inputs":[{"voxel":"structural-metal","quantity":4},{"voxel":"mechanical-components","quantity":4},{"voxel":"electrical-components","quantity":4}],"outputs":[{"voxel":"industrial-machinery","quantity":4}]},"display":{"name":"生产机床","description":"正式经济流程；批量、价值与速率为待用户试玩确认的第一版。"}}
