{"schema_version":1,"id":"ferrous-mining","simulation":{"kind":"extraction","work_required":30,"power_per_work":1,"labor_per_work":1,"facility_tag":"extraction","extracts":{"voxel":"ferrous-ore","quantity":4},"environment":{"terrain_types":["mountains","hills"]}},"display":{"name":"开采铁矿石","description":"正式经济流程；批量、价值与速率为待用户试玩确认的第一版。"}}
