{"schema_version":1,"id":"electronic-components-assembly","simulation":{"kind":"production","work_required":40,"power_per_work":1,"labor_per_work":1,"facility_tag":"electronics","inputs":[{"voxel":"electrical-components","quantity":4},{"voxel":"specialty-material","quantity":4},{"voxel":"glass","quantity":4},{"voxel":"polymer","quantity":4}],"outputs":[{"voxel":"electronic-components","quantity":4}]},"display":{"name":"生产电子部件","description":"正式经济流程；批量、价值与速率为待用户试玩确认的第一版。"}}
