{"schema_version":1,"id":"construction-block-making","simulation":{"kind":"production","work_required":20,"power_per_work":1,"labor_per_work":1,"facility_tag":"building_materials","inputs":[{"voxel":"construction-material","quantity":4}],"outputs":[{"voxel":"construction-block","quantity":4}]},"display":{"name":"生产混凝土块","description":"正式经济流程；批量、价值与速率为待用户试玩确认的第一版。"}}
