{"schema_version":1,"id":"recover-bogie","simulation":{"kind":"recovery","work_required":20,"power_per_work":1,"labor_per_work":1,"facility_tag":"recovery","inputs":[{"voxel":"bogie","quantity":4}],"outputs":[{"voxel":"structural-metal","quantity":1},{"voxel":"mechanical-components","quantity":1}]},"display":{"name":"回收转向架","description":"正式经济流程；批量、价值与速率为待用户试玩确认的第一版。"}}
