{"schema_version":1,"id":"oil-refining","simulation":{"kind":"production","work_required":30,"power_per_work":2,"labor_per_work":1,"facility_tag":"chemical","inputs":[{"voxel":"crude-oil","quantity":4}],"outputs":[{"voxel":"fuel","quantity":4},{"voxel":"chemical-feedstock","quantity":4}]},"display":{"name":"生产燃料","description":"正式经济流程；批量、价值与速率为待用户试玩确认的第一版。"}}
