{"schema_version":1,"id":"recover-electronic-components","simulation":{"kind":"recovery","work_required":20,"power_per_work":1,"labor_per_work":1,"facility_tag":"recovery","inputs":[{"voxel":"electronic-components","quantity":4}],"outputs":[{"voxel":"electrical-components","quantity":1},{"voxel":"specialty-material","quantity":1},{"voxel":"polymer","quantity":1}]},"display":{"name":"回收电子部件","description":"正式经济流程；批量、价值与速率为待用户试玩确认的第一版。"}}
