{"schema_version":1,"id":"prepared-food-processing","simulation":{"kind":"production","work_required":60,"power_per_work":1,"labor_per_work":1,"facility_tag":"food_processing","inputs":[{"voxel":"grain","quantity":4},{"voxel":"produce","quantity":4},{"voxel":"animal-products","quantity":4}],"outputs":[{"voxel":"prepared-food","quantity":4}]},"display":{"name":"生产加工食品","description":"正式经济流程；批量、价值与速率为待用户试玩确认的第一版。"}}
