{"schema_version":1,"id":"lumber-processing","simulation":{"kind":"production","work_required":20,"power_per_work":1,"labor_per_work":1,"facility_tag":"light_industry","inputs":[{"voxel":"timber","quantity":4}],"outputs":[{"voxel":"lumber","quantity":4}]},"display":{"name":"生产木材","description":"正式经济流程；批量、价值与速率为待用户试玩确认的第一版。"}}
